{"delivery_class":"timer","event_type":"authoritative_timer_event","event_version":"0.1","new_authoritative_time":"2026-07-21T00:10:00Z","prior_transcript_digest":"sha256:bd2335dd624d3570d42e4677e0d2ea2b2b2e0f5c56c1913f9d17e50781b10bd7","reason_or_source_class":"CONSENT_EXPIRY_THRESHOLD","session_id":"urn:private-match:test:session:0001"}