{"delivery_class":"timer","event_type":"authoritative_timer_event","event_version":"0.1","new_authoritative_time":"2026-07-21T00:10:30Z","prior_transcript_digest":"sha256:6ddd4d0a9db1eff9811ecf907df8e59ac40d8e622686564468848f49c43492d0","reason_or_source_class":"EVALUATION_DEADLINE","session_id":"urn:private-match:test:session:0001"}